{
  "schema": "afi.replay-profile.v1",
  "replayabilityLevel": "pinned-inputs",
  "factsRequired": true,
  "datasetId": "ds-blofin-btcusdt-15m-2026w03",
  "codeCommit": "9f2c4d1ab8e7c3f5a6d4b2e1c9f8a7b6d5e4c3b2",
  "seed": "42",
  "evidenceRefs": ["ev-price-context-000123-001"],
  "evidenceHashes": [
    {
      "algorithm": "sha256",
      "canonicalizationVersion": "afi.hash.v1",
      "domainTag": "afi.d2.evidence",
      "value": "ca978112ca1bbdcafac231b39a23dc4da786eff8147c4e72b9807785afee48bb"
    }
  ],
  "sourceRefs": ["src-exchange-blofin-api"],
  "laneVersions": {
    "price-context": "v0.3.0"
  },
  "environmentNotes": "Node 20.x runtime; enrichment engine 1.4.2; deterministic lane config."
}
